{
  "format": "cissp-lesson",
  "schemaVersion": "1.0",
  "lesson": {
    "id": "cissp-w01-d01",
    "title": "CISSP Week 01 · Day 01 — 安全基础复习",
    "description": "CIA Triad（信息安全三要素）和风险基础八个概念；通过原理、类比、业务案例和主动回想重新建立基础知识。",
    "week": 1,
    "day": 1,
    "domain": 1,
    "createdAt": "2026-10-08T00:00:00Z",
    "linkedQuestionSetId": "w01d01-review-20261008-v1"
  },
  "sections": [
    {
      "id": "cia-basics",
      "title": "第一章 · CIA Triad（信息安全三要素）",
      "conceptIds": [
        "w01d01-confidentiality",
        "w01d01-integrity",
        "w01d01-availability"
      ]
    },
    {
      "id": "risk-basics",
      "title": "第二章 · 安全风险基础术语",
      "conceptIds": [
        "w01d01-asset",
        "w01d01-threat",
        "w01d01-vulnerability",
        "w01d01-risk",
        "w01d01-control"
      ]
    }
  ],
  "concepts": [
    {
      "id": "w01d01-confidentiality",
      "sectionId": "cia-basics",
      "term": {
        "en": "Confidentiality",
        "zh": "机密性"
      },
      "objective": "能够识别未经授权的信息披露，并根据业务目标选择合适的机密性控制。",
      "definition": "确保信息仅向获得授权的主体披露或提供访问。",
      "explanation": "机密性回答“谁可以看到或获取信息”。即使资料没有被修改或删除，只要未经授权的人看到敏感内容，也可能构成机密性事件。授权必须与业务职责对应。",
      "analogy": "医院病历像锁在档案柜中的私人文件：只有因工作需要且经过授权的医生和工作人员才能打开。",
      "scenario": "医院员工利用不属于其职责的权限读取另一名患者的病历。记录完整、系统正常运行，但仍发生了未授权披露。",
      "controls": [
        "Encryption（加密，保护传输或存储的敏感数据）",
        "Access Control（访问控制，限制读取主体）",
        "Least Privilege（最小权限，仅赋予职责所需权限）"
      ],
      "commonMistake": "认为“数据未被篡改就没有安全问题”。机密性与完整性是不同的安全目标；普通哈希并不能阻止信息被读取。",
      "examTip": "题干强调“未经授权查看、读取、披露”时优先考虑机密性；选择 BEST 控制应先结合数据敏感性与访问需求。",
      "recall": {
        "prompt": "员工未经授权浏览客户信息，但没有修改任何数据，最直接受损的 CIA 属性是什么？",
        "answer": "Confidentiality（机密性）。未授权读取本身即可能造成信息泄露，不要求发生修改或服务中断。"
      }
    },
    {
      "id": "w01d01-integrity",
      "sectionId": "cia-basics",
      "term": {
        "en": "Integrity",
        "zh": "完整性"
      },
      "objective": "理解数据的准确性、一致性与授权变更要求，区分完整性检测和保密。",
      "definition": "确保信息和处理过程保持正确、完整，并且只在授权情况下发生预期变更。",
      "explanation": "完整性主要回答“信息是否可信、是否被不当更改”。校验值或哈希比较可检测变化，但只有可信的基线和适当的密钥/身份保障，才能合理判断变化是否可信或来自谁。",
      "analogy": "财务账本每次正式改账都应有授权依据和可追溯记录；被人偷偷改掉一个数字，账本就失去可信性。",
      "scenario": "攻击者修改工资发放文件，将某员工的收款账号替换为自己的账号。即使数据仍可被读取，其完整性已经受损。",
      "controls": [
        "Cryptographic Hash（密码学哈希，与可信基线比较以检测变化）",
        "Digital Signature（数字签名，在适当前提下支持完整性与来源鉴别）",
        "Change Control（变更控制，确保修改经过授权和核查）"
      ],
      "commonMistake": "把哈希等同于加密：哈希不提供机密性。也不要认为单纯计算哈希就能阻止恶意修改；哈希基线若同样被攻击者控制，检测意义会下降。",
      "examTip": "题干出现“未经授权修改、篡改、数据准确性”时，先判断完整性目标，再根据约束选择预防、检测或追溯措施。",
      "recall": {
        "prompt": "关键交易数据被偷偷更改，但服务没有中断，也没有直接泄露信息，首先涉及哪个安全目标？",
        "answer": "Integrity（完整性）。数据未经授权改变，导致数据的准确性或可信性受损。"
      }
    },
    {
      "id": "w01d01-availability",
      "sectionId": "cia-basics",
      "term": {
        "en": "Availability",
        "zh": "可用性"
      },
      "objective": "理解关键服务按业务需要持续可访问，以及冗余、切换、恢复演练的作用。",
      "definition": "确保经过授权的用户在需要时能够及时获得信息和服务。",
      "explanation": "可用性回答“需要用时能不能用”。硬件故障、勒索软件、断电和拒绝服务攻击都可能降低可用性。设计时应依据业务对中断和恢复的可接受程度配置控制。",
      "analogy": "医院急诊系统像急救供电：平时运转不够，还应在主电源故障时能切换到备用方案。",
      "scenario": "电商结算服务因单点服务器故障宕机，顾客无法支付。数据库内容未必泄露或篡改，但关键业务服务不可用。",
      "controls": [
        "Redundancy（冗余，减少单点故障）",
        "Failover（故障转移，故障时切换至备用能力）",
        "Backup and Restore Test（备份及恢复测试，验证恢复可行性）"
      ],
      "commonMistake": "只看到“每天有备份”就认定可用性已得到保障；未测试恢复，无法证明能在业务要求的时间内恢复服务。",
      "examTip": "题干强调“停机、服务中断、无法及时访问”时先考虑可用性；BEST 控制需参考业务连续性与恢复要求。",
      "recall": {
        "prompt": "系统数据既没有泄露也没有被修改，但授权用户连续数小时无法访问，主要受损的是哪一属性？",
        "answer": "Availability（可用性）。关键在于合法业务无法按需使用系统。"
      }
    },
    {
      "id": "w01d01-asset",
      "sectionId": "risk-basics",
      "term": {
        "en": "Asset",
        "zh": "资产"
      },
      "objective": "在业务安全情景中准确识别需要保护、具有业务价值的信息及相关资源。",
      "definition": "对组织具有价值并需要适当保护的信息、系统、服务、设备或其他资源。",
      "explanation": "资产不只包括硬件，客户信息、数据库、关键业务服务、知识产权等也可以是资产。识别资产及其价值有助于判断潜在损失及保护优先级。",
      "analogy": "一家银行的金库不仅包括保险柜，还包括其中的钱、账目记录和能够正常办理业务的服务。",
      "scenario": "某公司维护客户订单数据库及在线结算服务；客户订单数据和关键业务服务均属于应纳入风险分析的资产。",
      "controls": [
        "Asset Inventory（资产清单，识别资产）",
        "Information Classification（信息分类，区分敏感程度）",
        "Ownership Assignment（明确资产责任人）"
      ],
      "commonMistake": "把攻击者视为资产，或者只将实体服务器视为资产而忽略其承载的数据与业务流程。",
      "examTip": "风险判断应先回答“保护什么、对业务有多重要”，而不是直接选择某个安全产品。",
      "recall": {
        "prompt": "某企业案例中的客户数据库、敏感记录以及在线交易服务，哪些可以被视为资产？",
        "answer": "都可以是资产：它们具有业务价值，需要识别其价值与相应保护需求。"
      }
    },
    {
      "id": "w01d01-threat",
      "sectionId": "risk-basics",
      "term": {
        "en": "Threat",
        "zh": "威胁"
      },
      "objective": "把可能造成损害的威胁来源与具体弱点、已经发生的安全事件区分开。",
      "definition": "可能对资产或组织造成损害的潜在原因、事件或行为主体。",
      "explanation": "威胁可能来自恶意人员、自然灾害、意外操作或系统故障。威胁的存在并不自动表示损失已经发生；风险还需考虑特定资产、弱点、可能性和影响。",
      "analogy": "暴雨是威胁；暴雨可能造成什么损失，还与房屋的位置、排水设计以及保护设施有关。",
      "scenario": "攻击者有意获取企业客户数据库中的个人信息。攻击者及其恶意行为构成相关威胁来源。",
      "controls": [
        "Threat Identification（威胁识别）",
        "Threat Modeling（威胁建模，结合资产与业务场景）"
      ],
      "commonMistake": "将“数据库存在 SQL 注入漏洞”叫作威胁。漏洞是系统弱点；尝试利用漏洞的行为或主体才属于威胁。",
      "examTip": "看到“攻击者、洪水、失火、误操作”等描述，先判断其是否是威胁源，不要直接与漏洞或风险混为一谈。",
      "recall": {
        "prompt": "攻击者准备利用系统缺陷窃取客户信息。在这个描述中，攻击者属于哪个概念？",
        "answer": "Threat（威胁），即可能造成损害的行为主体或威胁源。"
      }
    },
    {
      "id": "w01d01-vulnerability",
      "sectionId": "risk-basics",
      "term": {
        "en": "Vulnerability",
        "zh": "脆弱性／漏洞"
      },
      "objective": "识别可能被威胁利用的技术、流程或人员方面的弱点。",
      "definition": "资产、系统、流程或控制中可被相关威胁利用的弱点。",
      "explanation": "脆弱性可以是软件缺陷、错误权限、薄弱流程或缺少必要控制。弱点本身并非损失；只有结合威胁、暴露程度以及业务影响才能评估风险。",
      "analogy": "门锁已经损坏是脆弱性；可能趁机入侵的窃贼则是威胁，两者不是同一概念。",
      "scenario": "Web 应用直接拼接用户输入生成 SQL 查询，攻击者可能据此改变查询逻辑。这是潜在 SQL 注入脆弱性。",
      "controls": [
        "Secure Coding（安全编码，使用参数化查询）",
        "Configuration Review（配置检查）",
        "Vulnerability Assessment（脆弱性评估）"
      ],
      "commonMistake": "将“SQL 注入缺陷”视为一次已经发生的数据泄露。漏洞可存在但尚未被利用；现实风险还依赖情景。",
      "examTip": "遇到“缺陷、配置错误、权限过大、未修补”等词语，优先识别脆弱性，再评估业务风险。",
      "recall": {
        "prompt": "开发人员直接把用户输入拼接到 SQL 语句中，这是威胁、脆弱性还是风险？",
        "answer": "Vulnerability（脆弱性／漏洞）。它是可能被利用的系统弱点。"
      }
    },
    {
      "id": "w01d01-risk",
      "sectionId": "risk-basics",
      "term": {
        "en": "Risk",
        "zh": "风险"
      },
      "objective": "基于具体资产、威胁、脆弱性及业务影响描述潜在风险，并理解风险优先级评估。",
      "definition": "特定不确定事件对业务目标产生不利影响的可能性及其影响。",
      "explanation": "在本课的安全情景中，可将风险理解为：某项威胁可能利用脆弱性，进而对资产或业务造成损失。风险评估需同时关注发生可能性与影响程度，不能只数漏洞个数或只看技术严重性。",
      "analogy": "房屋门锁损坏、附近有人盗窃且屋内有贵重物品时，失窃是需要评估的风险；门锁缺陷不是损失本身。",
      "scenario": "攻击者可能利用订单系统的 SQL 注入缺陷访问客户资料，导致隐私泄露、监管义务及业务信誉方面的损失。",
      "controls": [
        "Risk Assessment（风险评估，分析可能性和影响）",
        "Risk Register（风险登记，记录责任及处置）",
        "Risk-Based Prioritization（基于风险确定优先级）"
      ],
      "commonMistake": "把“攻击者”“SQL 注入缺陷”或“数据库”单独称作风险；它们分别对应威胁、脆弱性与资产。风险是潜在的不利业务结果。",
      "examTip": "FIRST/BEST 问题通常要求结合业务需求、资产价值和风险评估选择行动；不要未经分析就先采购工具。",
      "recall": {
        "prompt": "攻击者可能利用 SQL 注入缺陷窃取客户资料，造成客户信任损失。这里的“可能发生的数据泄露及其影响”属于什么？",
        "answer": "Risk（风险），应结合可能性和业务影响来评估。"
      }
    },
    {
      "id": "w01d01-control",
      "sectionId": "risk-basics",
      "term": {
        "en": "Control",
        "zh": "控制措施"
      },
      "objective": "认识控制措施如何预防、检测或减轻风险，并选择与业务风险相匹配的控制。",
      "definition": "组织采取的管理、技术或物理方面的措施，用于修改风险的可能性、影响或可检测性。",
      "explanation": "控制措施可能是预防性的（阻止事件）、侦测性的（发现异常）或纠正性的（帮助修复与恢复）。合理控制应针对已识别的风险，关注有效性和成本，而不是假设某一种产品消除所有风险。",
      "analogy": "房屋的可靠门锁能预防闯入，监控摄像头帮助发现异常，事后修复设施则帮助恢复；不同措施解决不同问题。",
      "scenario": "针对 SQL 注入风险，应用使用参数化查询限制注入，数据库采用最小权限限制影响，并通过日志与监测发现可疑访问。",
      "controls": [
        "Parameterized Query（参数化查询，主要是预防）",
        "Least Privilege（最小权限，限制潜在损害）",
        "Monitoring and Logging（监测和日志，主要是检测）"
      ],
      "commonMistake": "认为部署防火墙、加密或备份中的任何一种就能解决所有问题；控制需依据具体风险目标选择与组合。",
      "examTip": "管理者视角的 BEST 控制是针对重要风险、可实施并能验证效果的组合，不一定是最昂贵的技术。",
      "recall": {
        "prompt": "面对 SQL 注入风险，使用参数化查询、最小权限和日志审计分别在做什么？",
        "answer": "它们都是 Control（控制措施）：分别主要用于预防注入、限制影响与检测异常。"
      }
    }
  ],
  "caseStudy": {
    "title": "综合案例：客户数据库安全风险分析",
    "background": "一家在线零售公司使用 Web 应用连接客户订单数据库。审计发现应用将外部输入直接拼接到 SQL 查询中。管理层准备评估风险并决定如何治理。",
    "steps": [
      {
        "label": "Asset（资产）",
        "detail": "客户个人资料、订单数据库以及依赖该数据库的在线交易业务。"
      },
      {
        "label": "Threat（威胁）",
        "detail": "外部攻击者可能试图构造恶意输入，读取或改变客户信息。"
      },
      {
        "label": "Vulnerability（脆弱性）",
        "detail": "应用未经正确参数化处理，将不可信输入拼接进 SQL 语句。"
      },
      {
        "label": "Risk（风险）",
        "detail": "攻击者可能利用该缺陷造成未授权读取、篡改或业务损失；应评估发生可能性及其业务影响。"
      },
      {
        "label": "Control（控制措施）",
        "detail": "优先结合业务风险评估，实施参数化查询、最小权限、测试及必要的监测，并核实控制效果。"
      }
    ],
    "takeaway": "CIA 帮你判断什么安全目标受损；资产、威胁、脆弱性与风险帮你分析为什么重要；控制措施则针对风险降低可能性或影响。上述步骤用于梳理概念，不代表现实中的威胁与漏洞按固定时间顺序出现。CISSP FIRST/BEST 题要以业务目标和风险优先级作为决策依据。"
  }
}
